412;Sun - Blue;52; ¿Aceptas bromas?; sí; no; Depende de la situación;
413;Sun - Blue;52; Tienes que salir con alguien pero tu película favorita está por comenzar, ¿qué haces?;salgo de todos modos; me quedaré en casa; Me invento una excusa para no salir;
414;Sun - Blue;52; Tienes que acompañar a alguien a una cita médica pero tienes un compromiso, ¿qué haces?; yo lo acompaño; invento una excusa; Lo llamo y le digo la verdad;
415;Sun - Blue;52; Antes de tomar una decisión, ¿qué haces?; lo pienso mucho; Consulto con amigos o familiares; nunca decido nada;
416;Sun - Blue;52; ¿Cómo eliges a tus amigos?; siempre tengo los mismos amigos; cambio de amigos muy a menudo; prefiero estar solo;
417;Sun - Blue;52; ¿Decide de forma independiente cómo y dónde pasar sus vacaciones?; sí; no; poco frecuentemente; casi siempre
418;Sun - Blue;52; ¿Visitas a menudo las casas de otras personas?; sí; no; poco frecuentemente; casi siempre
419;Sun - Blue;52; ¿Compartes aficiones con alguien más?; sí; no; Me encantaría;
420;Sun - Blue;52; ¿Cuál es el momento del día en el que más te relajas?; Mañana; tardecita; noche;
421;Sun - Blue;52; ¿Qué buscas cuando ves una película?; divertida; emociones; despreocupado;
422;Sun - Blue;52; te gusta vestir:; elegante; casual; deportivo;con mi propio estilo refinado
423;Sun - Blue;52; Cuando estás en una fiesta, ¿cómo te sientes?; observado; solo; contento;
424;Sun - Blue;52; ¿Qué vehículo usarías para hacer un viaje al mar?; moto acuática; lancha rápida; bote de pedales;
425;Sun - Blue;52; ¿Te gustaría ser diferente de lo que eres?; sí; no; algunas veces; casi siempre
426;Sun - Blue;52; ¿Te consideras un ganador?; sí; no; poco frecuentemente; casi siempre
427;Sun - Blue;52; ¿Te sientes inferior a los demás?; sí; no; poco frecuentemente; casi siempre
428;Sun - Blue;52; ¿Puedes hacer discursos públicos?; sí; no; nunca lo he intentado;
429;Sun - Blue;52; ¿Te gustaría mejorar tu carácter?; sí; no; a veces me gustaría;
430;Sun - Red;54; ¿Cambiarías algo de tu personaje?; sí; no; cosas Pequeñas; casi todo
431;Sun - Red;54; ¿Tienes confianza en ti mismo?; sí; no; poco frecuentemente; casi siempre
432;Sun - Red;54; ¿Crees que eres lindo?; sí; no; suficiente; Espero
433;Sun - Red;54; ¿Te sientes indispensable para alguien?; sí; no; algunas veces;
434;Sun - Red;54; ¿Te prefieres en la foto o en el espejo?; foto; espejo; casi nunca me gusto; siempre me gusto
435;Sun - Red;54; ¿A menudo te sientes culpable por algo?; sí; no; poco frecuentemente;
436;Sun - Red;54; Cuando te felicitan, ¿crees que se lo merecen?; sí; no; poco frecuentemente; casi siempre
437;Sun - Red;54;¿Eres incómodo cuando conoces a alguien nuevo?; sí; no; suficiente;
438;Sun - Red;54; ¿Te consideras superior a las personas que te rodean?; sí; no; algunas veces;
439;Sun - Red;54; ¿Obtuviste lo que esperabas en la vida?; sí; no; solo parcialmente;
440;Sun - Red;54; ¿Crees que recibiste una buena educación?; sí; no; suficiente;
441;Sun - Red;54; ¿Crees que los demás se aprovechan de ti?; sí; no; algunas veces; casi siempre
442;Sun - Red;54; ¿Tiendes a subestimarte a ti mismo?; sí; no; algunas veces; casi siempre
443;Sun - Red;54; ¿Crees que tienes mala suerte?; sí; no; algunas veces; casi siempre
444;Sun - Red;54; ¿Crees que tus orígenes han influido en tu vida?; no hay duda; no; ciertamente en parte;
445;Sun - Red;54; ¿Crees que tu pasado ha afectado tu presente?; no hay duda; no; ciertamente en parte;
446;Sun - Red;54; ¿Te sientes hermosa?; sí; no; algunas veces;
447;Sun - Red;54; ¿Te gusta ir al estadio?; algunas veces; nunca ha sido; es algo que no me interesa;
448;Moon - Light Blue;32; ¿Te gusta cenar solo en el restaurante?; sí; no; algunas veces;
449;Moon - Light Blue;32; ¿Te sientes incómodo cuando estás en un ascensor con un extraño?; sí; no; depende de con quien estoy tratando;
450;Moon - Light Blue;32; ¿Te gustaría hacer el trabajo de un representante de ventas?; sí; no; Lo he hecho en el pasado, pero no me gustó.;
451;Moon - Light Blue;32;¿Qué libro elegirías: La Odisea o El retrato de Dorian Gray?; La odisea; El retrato de Dorian Gray; no me gusta leer;
452;Moon - Light Blue;32; ¿Simpatizas con el equipo más fuerte o con el más débil?; el más fuerte; El más débil; Casi no simpatizo con ningún equipo.;
453;Moon - Light Blue;32; ¿Prefieres ir al cine o ver una película en casa?; cine; hogar; nunca veo peliculas;
454;Moon - Light Blue;32; ¿Tienes juegos de mesa en casa?; sí; no; tal vez alguien de cuando era niño;
455;Moon - Light Blue;32; ¿A menudo te sientes vigilado por los demás?; sí; no; algunas veces;
456;Moon - Light Blue;32; ¿Te irías a vivir con un extraño?; sí; no; depende si me gusta fisicamente;
457;Moon - Light Blue;32; ¿Te gustaría ir a un nuevo país donde nadie te conozca?; sí; no; esto depende del país;
458;Moon - Light Blue;32; ¿Te gustaría contar tu vida completamente diferente a la real?; sí; no; a veces me gustaría;
459;Moon - Light Blue;32; ¿Tienes miedo de perderte?; sí; no; solo si estoy en un lugar que no conozco;
460;Moon - Light Blue;32; Un objeto está a punto de caerse de la mesa, ¿qué haces?; trato de agarrarlo; lo dejo caer;Hago como que no lo veo caer;
461;Moon - Light Blue;32; Debido a una fuerte tormenta pierdes un viaje en barco programado, ¿qué haces?; reservo para otro dia; Espero que termine el mal tiempo; Voy directo a otro lugar con amigos;
462;Moon - Light Blue;32; Alguien grita porque le acaban de robar, que haces?; hago como que no lo escucho; corro en su ayuda; pido ayuda;
463;Moon - Light Blue;32; Si piensas en una pelota, ¿qué movimiento está haciendo?; se está deslizando; esta girando; la pelota se detiene;
464;Moon - Light Blue;32; Un competidor de tu empleador te ofrece un salario más alto, ¿qué haces?; acepto inmediatamente; rechazo la oferta; lo pienso;
465;Moon - Light Blue;32; ¿Dónde te relajas más?; en mi casa; mar; montaña;
466;Moon - White;34; ¿Cuál es tu género literario favorito?; novela; horror; poesía;
467;Moon - White;34; ¿Te gusta vestir?; un sombrero; un pañuelo; nada;
468;Moon - White;34; ¿Tienes muchos amigos?; sí; suficiente; Lamentablemente no;
469;Moon - White;34; ¿Te gustaría cambiar tu nombre?; Sí; no; a veces me gustaría;
470;Moon - White;34;Un extraño te invita a bailar...; acepto inmediatamente; declino la invitación; me hago desear;
471;Moon - White;34; Estás en una cena con extraños, ¿cómo te sientes?; cómodo; incómodo; protagonista absoluto;
472;Moon - White;34; Recibes una invitación a cenar de tu mejor amigo en un lugar refinado, ¿qué te parece?; el quiere hablar conmigo; me parece muy extraño; un buen gesto;
473;Moon - White;34; Te piden que escales una pequeña montaña…; declino la invitación; acepto con entusiasmo; invento una excusa;
474;Moon - White;34; Tus amigos te han preparado una fiesta sorpresa...; me podrian avisar; que hermosa idea; me siento como una estrella;
475;Moon - White;34; Cuando caminas...; Evito pisar las juntas del pavimento; Miro directamente a mi manera; Miro a mi alrededor;
476;Moon - White;34; Tu organizas tus vacaciones...; meses de antelación; en el último minuto; buscando la relación precio/calidad adecuada;
477;Moon - White;34; ¿Cómo se celebra un aniversario?; no lo celebro; siempre doy un regalo;organizo una velada romantica;
478;Moon - White;34; Te presentan a una persona pero no entiendes el nombre, ¿qué haces?; pido el nombre; Planeo solicitar el nombre más tarde.; finjo que lo entiendo;
479;Moon - White;34; ¿Prefieres permanecer en silencio a menudo?; nunca; Sí; algunas veces;
480;Moon - White;34; Encuentras que las personas que siempre bromean son:; superficial; gracioso; inteligente;
481;Moon - White;34; Odias ir a conciertos porque están demasiado llenos:; real; falso; no me interesan los conciertos;
482;Moon - White;34; ¿Considera que los vendedores son personas confiables?; no, solo quieren vender; seguramente; Depende de la persona;
483;Moon - White;34; Cuando sales con tu amigo, ¿intentas vestirte de acuerdo con su atuendo?; nunca; siempre; tengo mi propia forma de vestir;
484;Moon - Red;33; ¿Te da vergüenza invitar a alguien a una cita?; muchisimo; de ninguna manera; depende de a quien le pregunte;
485;Moon - Red;33; Si un vendedor sigue insistiendo en venderle un producto, ¿lo comprará finalmente?; no; más probable es que sí; depende si me gusta;
486;Moon - Red;33;¿Crees que tu carácter está condicionado por las condiciones climáticas?; con frecuencia; algunas veces; nunca; siempre
487;Moon - Red;33; Considero a los hombres superficiales cuando:; solo piensan en divertirse; solo piensan en dinero; ellos menosprecian todo;
488;Moon - Red;33; Si nací en otro lugar...; hubiera sido la misma persona; hubiera tenido mas oportunidades; hubiera conocido a mejores personas;
489;Moon - Red;33; Has ganado una entrada para 2 personas para asistir a un importante evento social, ¿qué decides hacer?; Me rindo; invito a alguien; voy solo;
490;Moon - Red;33; Cuando suena el teléfono piensas:; me estan molestando; debe ser algo importante; me llaman para invitarme a algun lado;
491;Moon - Red;33; Tienes que entretener a dos niños, ¿qué haces?; trato de hacerlos reir; les cuento una historia; los hago jugar entre ellos;
492;Moon - Red;33; Entras en una habitación y la gente está hablando de ti, ¿qué piensas?; me estarán felicitando; No tengo ni idea;se burlaran de mi;
493;Moon - Red;33; Después de mucho tiempo tienes una tarde libre, ¿qué haces?; salgo a cenar; me siento en el sofa a ver una pelicula; Llamo a todos para organizar una fiesta;
494;Moon - Red;33; Tu teléfono está muerto, ¿cómo te sientes?; perdió; indiferente; ansioso; contento
495;Moon - Red;33; Estás siendo cortejado por la persona más sexy de la ciudad, ¿qué haces?; les digo a todos; me lo guardo para mi; no confío en su cortejo;
496;Moon - Red;33; Si durante una jornada laboral no tienes nada que hacer, ¿cómo te sientes?; aburrido; deprimido; soy feliz asi que descanso;
497;Moon - Red;33; ¿Qué comida nunca te saltearías?; desayuno; comida; cena; Bocadillo de la tarde
498;Moon - Red;33; ¿Crees que las cosas pueden estar condicionadas por la suerte?; si, absolutamente; de ninguna manera; a veces lo pienso;
499;Moon - Red;33; ¿Te gusta ver en la televisión:; un espectáculo policial; un programa de cocina; un documental cientifico;
500;Moon - Red;33; Tu pareja elige pasar las vacaciones con sus amigos y no contigo, ¿tú qué opinas?;él/ella prefiere quedarse con ellos; el/ella necesita relajarse; el/ella ya no es mi pareja;
501;Moon - Red;33; ¿Te gusta cuidar las flores?; sí mucho; No, en absoluto; Me gustaría;
502;Moon - Green;31; Ir rápido significa:; correr un gran riesgo; sentir una fuerte emoción; trata de llegar a tiempo;
503;Moon - Green;31; Tienes que crear un ambiente divertido, ¿cómo lo haces?; pongo la musica; hago chistes; Naturalmente, no quiero ser gracioso.;
504;Moon - Green;31; Si tuviera que escribir sus defectos en una hoja de papel, ¿cómo sería el papel?; quedaría en blanco; tendría algunas líneas llenas; tal vez no cabrían todos en un papel;
505;Moon - Green;31; ¿Con quién celebras un éxito?; solo; solo con los que amo; con tantas personas como sea posible;
506;Moon - Green;31; ¿Conocer gente nueva te da energía?; sí; no; poco; depende de la gente que conozca
507;Moon - Green;31; ¿Cuál de estos juegos prefieres?; tarjetas; ajedrez; Monopolio;
508;Moon - Green;31;Tienes 2 horas inesperadas de tiempo, ¿qué haces?; voy al cine; visito un museo; yo hago deportes; yo duermo
509;Moon - Green;31; ¿Te gustaría refugiarte...; en un castillo; en un bosque; en un maizal;
510;Moon - Green;31; ¿Cómo pasarías una noche en una gran metrópoli?; Iría a un buen lugar a beber y bailar.; en un hermoso restaurante; caminando por las calles del centro;
511;Moon - Green;31; ¿Cuántos son tus mejores amigos?; entre 2 y 4; sólo uno; más de 5;
512;Moon - Green;31; ¿Cómo te describiría tu profesor de primaria?; tímido y reservado; inquieto; dinámico;
513;Moon - Green;31; ¿Tienes muchas cosas que decir?; sí; no; poco frecuentemente; depende del contexto
514;Moon - Green;31; Después de hablar con la gente durante mucho tiempo, ¿prefieres estar solo?; sí; no; algunas veces; casi siempre
515;Moon - Green;31; ¿Le gustaría tener alguna obra de arte para mostrar en público?; sí; no; no me interesa el arte;
516;Moon - Green;31; ¿Te gustaría vivir en una casa con muchos extraños?; sí; no; no sé, debería intentarlo;
517;Moon - Green;31;Te han presentado a un amigo de tu amigo, ¿cómo te comportas?; nos hacemos amigos rapidos; yo me quedo en el mio; trato de conocerlo mejor;
518;Moon - Green;31; ¿Te encanta usar ropa provocativa?; sí; no; solo en raras ocasiones;
519;Moon - Green;31; ¿Dormirías tranquilo incluso con una persona desconocida?; sí; no; No sé;
520;Job - Green;15; El patrón te obliga a trabajar siempre horas extras, ¿tú qué opinas?; Lo dejo; seré importante en la empresa; ganaré más;
521;Job - Green;15; ¿Qué siente tu cuerpo después de trabajar?; cansancio; energía; resistencia;
522;Job - Green;15; ¿Prefieres trabajar como empresario o como empleado?; emprendedor; empleado; cada uno tiene sus lados positivo y negativo;
523;Job - Green;15; ¿Qué es lo que más te cansa?; trabajo manual; trabajo mental; no trabajo;
524;Job - Green;15; La empresa está en crisis y el empresario te pide que trabajes gratis unas horas por el bien de la empresa. ¿Aceptas?; sí; no; solo si propone un futuro aumento de sueldo;
525;Job - Green;15;¿A qué nunca renunciarías entre estas cosas?; vacaciones de verano; vacaciones de invierno; un café después del almuerzo;
526;Job - Green;15; ¿Sabes exactamente cuánto dinero tienes en tu cartera?; sí; no; poco frecuentemente; casi siempre
527;Job - Green;15; ¿Sabes exactamente, además de dinero, lo que tienes en la cartera?; sí; no; poco frecuentemente; casi siempre
528;Job - Green;15; ¿Qué animal elegirías entre estos para representar a tu familia?; un felino; un paquidermo; un pájaro;
529;Job - Green;15; ¿Te gustaría crear una empresa que pueda ayudar a los países en desarrollo?; sí; no; no se pero puede ser interesante;
530;Job - Green;15; ¿Lees las etiquetas en el supermercado?; sí; no; poco frecuentemente; casi siempre
531;Job - Green;15; ¿Te gustaría organizar un concierto?; sí; no; No sé; Podría ser Interesante
532;Job - Green;15; ¿Te gusta ver comerciales?; si, suficiente; no; me encantan los comerciales; odio los comerciales
533;Job - Green;15; ¿Eres bueno dibujando?; sí; no; yo era de adolescente;
534;Job - Green;15; ¿Te gustaría actuar?; sí; no; a veces me gustaría probar;
535;Job - Green;15; ¿Consideras tu ciudad ecosostenible?; sí; no; poco;
536;Job - Green;15; ¿Consideras a Al Pacino un gran actor?; sí; no; lo considero el mejor;
537;Job - Green;15;¿Te gustaría vivir en las Maldivas?; sí mucho; no; No sé; preferiría otros lugares
538;Job - Green;15; ¿Alguna vez has pensado en cómo harías un comercial?; sí; no; no, pero me gustaria;
539;Job - Green;15; ¿Recibirías a un adicto en tu casa?; sí; no; solo si lo conozco; Admiro a los que lo hacen
540;Job - Green;15; ¿Participarías en un descenso en canoa desde un arroyo?; sí; no;tal vez, nunca lo he intentado;
541;Job - Red;16; ¿Te interesa entender una obra de arte?; sí; no; solo si me gusta;
542;Job - Red;16; ¿Promoverías una campaña para defender los derechos de los niños?; sí; no; Me encantaría; yo no sería capaz de
543;Job - Red;16; ¿Recitarías un poema en la radio?; sí; no; nunca, por ningún motivo; quizás
544;Job - Red;16; ¿Te asustan los espacios cerrados?; sí; no; solo si esta oscuro;
545;Job - Red;16; ¿En qué sector le gustaría iniciar un negocio?; bienes raíces; artesanía; Nunca quisiera tener mi propio negocio.;
546;Job - Red;16; ¿Se arrepintió del curso de estudio que hizo?; sí; no; algunas veces; muy a menudo
547;Job - Red;16; ¿Estarías dispuesto a cambiar tu vida por una oportunidad laboral?; sí; no; depende de la oferta;
548;Job - Red;16; ¿Tu currículum refleja tu puesto de trabajo?; absolutamente no; sí; quizás;tengo un trabajo maravilloso
549;Job - Red;16; ¿La gente que conoces estaría dispuesta a presentarte a alguien para una oferta de trabajo importante?; sí; no; tal vez, pero son envidiosos;
550;Job - Red;16; ¿Crees que la presencia física es importante para obtener un puesto de trabajo importante?; sí; no; fundamental;
551;Job - Red;16; ¿Alguna vez has ayudado a alguien a conseguir un trabajo?; sí; nunca; No tengo conexiones influyentes.;
552;Job - Red;16; ¿Por qué la gente está desempleada?; no quieren trabajar; no tienen las habilidades adecuadas; el mundo de los negocios es demasiado complicado;
553;Job - Red;16; Cuando lees sobre ofertas de trabajo ¿qué piensas?; los salarios son muy bajos; habilidades excesivas requeridas; solo los leo por curiosidad;
554;Job - Red;16; ¿Pueden los jóvenes desempeñar funciones importantes en el trabajo?; absolutamente sí; absolutamente no; depende de sus habilidades;
555;Job - Red;16; ¿Te gustaría trabajar como motivador para los demás?; yo no sería capaz de; Es mi sueño; No sé;
556;Job - Red;16; ¿Ve a sus compañeros como una amenaza para su carrera?; algunas veces; siempre; nunca;
557;Job - Red;16; ¿Te encanta detallar tu currículum?; sí mucho; No, en absoluto; solo menciono las cosas mas importantes;
558;Job - Red;16;¿Crees que una entrevista de trabajo online puede tener un resultado positivo?; sí; no; poco frecuentemente;
559;Job - Red;16; Tienes que entregar un trabajo para mañana por la mañana, aún no has terminado y ya es pasada la medianoche, ¿qué haces?; Aguanto hasta que termino; lo entrego incompleto; Me invento una excusa y no voy a trabajar;
560;Job - Red;16; Un equipo está motivado si:; la gente gana mucho; la gente se siente considerada; las personas se hacen amigas;
561;Job - Red;16; Cuando estás en el trabajo...; actúo como si fuera el jefe; trato de hacer bien mi trabajo; llamo a mis amigos;
562;Job - Blue;14; ¿Te gustaría contratar personas directamente?; sí; no; quizás; es muy dificil
563;Job - Blue;14; ¿Te gustaría organizar bodas?; sí; no; quizás; Es mi sueño
564;Job - Blue;14; ¿Te gustaría trabajar en sectores que contribuyan a la mejora ecológica?; sí; no; quizás; Es mi sueño
565;Job - Blue;14; ¿Te gustaría trabajar de cerca con los animales?; sí; no; muchisimo;
566;Job - Blue;14; Tu jefe es una buena persona pero no es consistente…; Odio a la gente inconsistente; lo mas importante es que sea buena persona;Ojalá fuera buena persona y además consecuente;
567;Job - Blue;14; ¿Qué tipo de abogado te gustaría ser?; Abogado Penalista; yo nunca seria abogado; un abogado que se ocupa de las causas sociales;
568;Job - Blue;14;"""Disciplina, trabajo. El trabajo, la disciplina.”";estoy de acuerdo;no estoy de acuerdo;estoy de acuerdo sólo en parte;
569;Job - Blue;14;"""El trabajo no es castigo para el hombre, es su recompensa, fuerza y placer.”";estoy de acuerdo;no estoy de acuerdo;estoy de acuerdo sólo en parte;
570;Job - Blue;14;“La recompensa del trabajo bien hecho es la oportunidad de hacer más trabajo bien hecho.”;estoy de acuerdo;no estoy de acuerdo;estoy de acuerdo sólo en parte;
571;Job - Blue;14;“Nuestra vida vale lo que nos ha costado en esfuerzo.”;estoy de acuerdo;no estoy de acuerdo;estoy de acuerdo sólo en parte;
572;Job - Blue;14;“El mayor cansancio proviene del trabajo no realizado.”;estoy de acuerdo;no estoy de acuerdo;estoy de acuerdo sólo en parte;
573;Job - Blue;14;“El artista no es nada sin el don, pero el don, no es nada sin trabajo.”;estoy de acuerdo;no estoy de acuerdo;estoy de acuerdo sólo en parte;
574;Job - Blue;14;“La avaricia, el estímulo de la industria.”;estoy de acuerdo;no estoy de acuerdo;estoy de acuerdo sólo en parte;
575;Job - Blue;14;“Halla la felicidad en tu trabajo o nunca serás feliz.”;estoy de acuerdo;no estoy de acuerdo;estoy de acuerdo sólo en parte;
576;Job - Blue;14;“Nada, que merezca la pena tenerse, viene a uno si no es como resultado de un trabajo duro.”;estoy de acuerdo;no estoy de acuerdo;estoy de acuerdo sólo en parte;
577;Job - Blue;14;“La pereza puede parecer atractiva, pero el trabajo da satisfacción.”;estoy de acuerdo;no estoy de acuerdo;estoy de acuerdo sólo en parte;
578;Job - Blue;14;“El trabajo es un olvido activo que conviene al alma fuerte.”;estoy de acuerdo;no estoy de acuerdo;estoy de acuerdo sólo en parte;
579;Job - Blue;14;“Convierte tu hobby en tu trabajo y no volverás a trabajar en la vida.”;estoy de acuerdo;no estoy de acuerdo;estoy de acuerdo sólo en parte;
580;Job - Blue;14;“De nada vale estar vivo si hay que trabajar.”;estoy de acuerdo;no estoy de acuerdo;estoy de acuerdo sólo en parte;
581;Job - Blue;14;“El placer que acompaña al trabajo pone en olvido a la fatiga.”;estoy de acuerdo;no estoy de acuerdo;estoy de acuerdo sólo en parte;
582;Job - Blue;14;“Los grandes trabajos no son hechos por la fuerza, sino por la perseverancia.”;estoy de acuerdo;no estoy de acuerdo;estoy de acuerdo sólo en parte;
583;Job - Blue;14; ¿Qué piensas de un trabajo de empleado?; aburrido; una excelente oportunidad; algo que da serenidad;
584;Wolves - Grey;59; Ha estado haciendo cola durante una hora y un joven pasa junto a usted. ¿Como reaccionas?; lo empujo hacia afuera; me enfado y discuto; Le invito amablemente a respetar la línea.;
585;Wolves - Grey;59;¿Crees que el uso de la violencia en determinadas situaciones es útil?; nunca; sí; solo para defenderme o defender a alguien querido para mi;
586;Wolves - Grey;59; ¿Cómo te comportas en una discusión muy acalorada?; no me expreso; pierdo la paciencia; trato de explicar mis razones;
587;Wolves - Grey;59; Cuando te enojas, ¿tiendes a romper algo?; sí; no; algunas veces; muy a menudo
588;Wolves - Grey;59; ¿Tiendes a evitar a las personas que siempre se quejan?; sí; no; no soporto a la gente que se queja;
589;Wolves - Grey;59; ¿Qué haces si estás atrapado en un atasco de tráfico?; Yo me enojo; llamo a mis amigos; pienso en mi trabajo;
590;Wolves - Grey;59; Un hombre te tira café encima. ¿Como reaccionas?; lo insulto; acepto la disculpa; Me enojo, pero inmediatamente me calmo tan pronto como se disculpa.;
591;Wolves - Grey;59; ¿Te gustaría ser Sylvester Stallone o Keanu Reeves?; Silvestre Stallone; Keanu Reeves; ninguno de los dos; ambos
592;Wolves - Grey;59; ¿Crees que el verano es el momento perfecto para conocer gente nueva?; sí; no; probablemente si; no hay momento ideal
593;Wolves - Grey;59; ¿Te gustan los matones?; sí; no; poco frecuentemente;
594;Wolves - Grey;59;¿A menudo dices mentiras?; sí; no; poco frecuentemente; muy a menudo
595;Wolves - Grey;59; ¿Estás dispuesto a hacer trampa para ganar?; sí; no; poco frecuentemente; casi siempre
596;Wolves - Grey;59; Si te dan el cambio equivocado, ¿lo denuncias?; sí; no; solo si me sirvieron amablemente;
597;Wolves - Grey;59; ¿Prefieres gran danés o chihuahua?; Gran Danés; chihuahuas; ninguno de los dos; me gustan los dos
598;Wolves - Grey;59; ¿Estás apoyando al león o la gacela?; León; gacela; no tengo preferencias;
599;Wolves - Grey;59; ¿Prefieres el perro o el gato?; perro; gato; ninguno de los dos; me gustan los dos
600;Wolves - Grey;59; ¿Eres ahorrativo?; sí; no; poco frecuentemente; casi siempre
601;Wolves - Grey;59; ¿Pasas la Navidad con tu familia?; sí; no; poco frecuentemente; casi siempre
602;Wolves - Grey;59; ¿Te gusta volver a ver películas antiguas o series de televisión?; si suficiente; no; me gusta mucho;
603;Wolves - Blue;58; ¿Haces el mismo trabajo que tus padres?; sí; no; no, pero me gustaria;
604;Wolves - Blue;58; ¿Te gustan los deportes peligrosos?; sí; no; no, pero me gustaria;
605;Wolves - Blue;58; ¿Te gustan las películas de horror?; sí; no; me gusta ver solo peliculas graciosas;
606;Wolves - Blue;58; ¿Te gustaría un trabajo que te haga viajar todo el tiempo?; sí; no; depende del trabajo que me ofrezcan;
607;Wolves - Blue;58; ¿Alguna vez te has mudado?; sí; no; una vez, hace muchos años;
608;Wolves - Blue;58; ¿Te arrepientes del pasado?; sí; no; poco frecuentemente; muy a menudo
609;Wolves - Blue;58;Si estás entre extraños, ¿tratas de conocerte?; sí; no; poco frecuentemente; casi siempre
610;Wolves - Blue;58; ¿Te gustaría ir al espacio?; sí; no; no, pero definitivamente sería emocionante;
611;Wolves - Blue;58; ¿Estás haciendo el trabajo que imaginabas de niño?; sí; No, en absoluto; no realmente, pero se acerca bastante;
612;Wolves - Blue;58; ¿Es el mundo un lugar lleno de oportunidades?; sí; no; si, pero solo para unos pocos;
613;Wolves - Blue;58; ¿Tomas bebidas azucaradas?; sí; no; poco frecuentemente; muy a menudo
614;Wolves - Blue;58; ¿Te gusta usar perfume?; sí; no; no me gustan los perfumes; solo para situaciones especiales
615;Wolves - Blue;58; ¿Prefieres un buen bistec o un buen plato de pescado?; un buen bistec; pez; ninguno de los dos; amo los dos
616;Wolves - Blue;58; ¿Sabes nadar?; seguramente; no, nunca lo he intentado; si, pero tengo miedo;
617;Wolves - Blue;58; ¿Prefieres Ferrari o Lamborghini?; ferrari; lamborghinis; ninguno de los dos; amo los dos
618;Wolves - Blue;58; ¿Te gusta caminar bajo la lluvia?; sí; no; solo en verano;
619;Wolves - Blue;58; ¿Es la infidelidad un gran defecto?; sí; no; sí, pero la tentación a veces es difícil de resistir;
620;Wolves - Blue;58; ¿Te gustan los pasteles de chocolate?; sí; no; nunca los como;
621;Wolves - Blue;58; ¿Te gusta la música clásica?; muchisimo; no, me aburre; suficiente; amo todos los generos musicales
