835;Soul - Red;50; ¿Te gustaría enseñar a un niño a jugar con otros niños?; sí; no;tal vez, nunca lo he intentado;
836;Soul - Red;50; ¿Te gustaría grabar frases en madera?; sí; no;tal vez, nunca lo he intentado;
837;Soul - Red;50; ¿Te gustaría estudiar especies marinas?; sí; no; tal vez, nunca lo hice;
838;Soul - Red;50; ¿Te gustaría trabajar en el ejército?; sí; no; tal vez, no lo sé;
839;Soul - Red;50; ¿Le gustaría recibir cumplidos por:; una buena personalidad; valentía; inteligencia;
840;Behave;2; ¿La gente respeta la ley por miedo a las sanciones?; seguramente; no; casi siempre;
841;Behave;2;¿La inmigración crea problemas?; seguramente; no; poco frecuentemente; muy a menudo
842;Behave;2; ¿La mayoría de la gente es mentirosa?; sí; no; solo es parcialmente cierto;
843;Behave;2; ¿Participa en algún evento político?; sí; no; poco frecuentemente; muy a menudo
844;Behave;2; ¿Eres voluntario en alguna asociación?; sí; no; poco frecuentemente; muy a menudo
845;Behave;2; ¿Respetas las señales de prohibición?; sí; no; poco frecuentemente; casi siempre
846;Behave;2; ¿Tienes cuidado de no contaminar?; sí; no; poco frecuentemente; casi siempre
847;Behave;2; ¿Escuchas la radio a todo volumen?; sí; no; poco frecuentemente; muy a menudo
848;Behave;2; Cuando ves a una persona en uniforme...; yo lo respeto; soy indiferente; tengo un sentimiento de resentimiento;
849;Behave;2; Cuando ves a tu amigo comportarse de forma extraña piensas:; él/ella quiere ser el centro de atención; él / ella debe haber tenido una infancia difícil; es una persona extrovertida;
850;Behave;2; Para lograr sus objetivos, con mucho gusto eludiría algunas reglas:; real; falso; depende de la importancia de mi objetivo;
851;Behave;2; ¿Cómo consideras a las personas que hacen voluntariado?; generoso; emprendedor; como todas las demás personas; audaz
852;Behave;2; Cuando conduces, ¿cómo te comportas?; soy imprudente; soy muy cuidadoso; Conduzco tranquilo escuchando buena música;
853;Behave;2;Vas en el autobús y ves a un anciano parado, ¿qué haces?; le dejo mi asiento; Estoy buscando un asiento libre para él.; Yo no hago nada;
854;Behave;2; Hablas con una persona que tiene problemas de audición y le cuesta entenderte, ¿qué haces?; Dejaré de hablar ahora; levanto mucho la voz; Enuncio las palabras más despacio.;
855;Behave;2; Te encuentras un maletín lleno de dinero en la calle, ¿qué haces?; Lo escondo y lo llevo a casa.; Saco el dinero y dejo el maletín ahí.; se lo entrego a la policia;
856;Behave;2; Las personas que no respetan la religión de los demás...; son incivilizados; tendrán sus razones; seguramente no respetan muchas otras cosas;
857;Behave;2; ¿Cuál de estos temas sientes más cercano a tu sensibilidad?; asistencia a ancianos; protección infantil; bienestar de los animales;
858;Behave;2; ¿Te ofrecerías como voluntario en un hogar de ancianos?; no; seguramente; No sé;
859;Behave;2; ¿Dejas de hacer lo que estás haciendo para ayudar a otros?; sí; no; poco frecuentemente; muy a menudo
860;Behave;2;¿Ayudarías a una persona discapacitada a vestirse?; sí; no;tal vez, nunca lo he intentado;
861;Behave;2; ¿Te interesan las leyes y sus aplicaciones?; sí; no; poco frecuentemente;
862;Behave;2; Una persona se siente mal a tu lado en el metro, ¿cómo te comportas?; lo/la ayudo inmediatamente; Inmediatamente llamo a una ambulancia; Pido ayuda a otras personas en el metro.;
863;Reaction - Blue;40; ¿Sobreviviste a un accidente de avión gracias a?; fue solo suerte; Dios; extrañas coincidencias;
864;Reaction - Blue;40; Durante un viaje en el metro ves a una mujer siendo asaltada sin darte cuenta. ¿Qué estás haciendo?; No sé; Llamaré a la policía; no pretendo nada;
865;Reaction - Blue;40; Presencias un ataque a unos metros de ti, ¿cómo te comportas?; ayudo a la persona agredida; Llamaré a la policía; permanezco inmóvil;
866;Reaction - Blue;40; Te encuentras con un hombre que te pide caridad, ¿cómo te comportas?; le dejo una oferta; lo insulto; me quedo indiferente;
867;Reaction - Blue;40; Tienes una rueda pinchada, ¿qué haces?; Yo lo cambie; pido ayuda; Espero que alguien se detenga y me ayude.;
868;Reaction - Blue;40; Te quedas solo en tu ciudad, ¿qué haces?; Me escapé; Me quedo en casa;Paso mis días vagando sin rumbo;
869;Reaction - Blue;40; Cuando miras las estrellas...; Puedo ver formas; admiro su belleza; me siento tan pequeño;
870;Reaction - Blue;40; Ves a una hermosa chica haciendo autostop durante una fuerte tormenta, ¿qué haces?; Me detengo y la dejo ir; finjo no verla; sigo mi camino;
871;Reaction - Blue;40; Acaba de ocurrir una colisión trasera, ¿qué haces?; Me detengo y pregunto si alguien resultó herido.; sigo mi camino; Llamaré a la policía;
872;Reaction - Blue;40; Cuando viajas en avión..; yo duermo; Yo leo; estoy ansioso;
873;Reaction - Blue;40; Detenido en el coche en una columna..; Espero a que termine la fila; Pienso como saltarme la columna; hago sonar la bocina;
874;Reaction - Blue;40; Te escapaste después de causar un accidente, ¿le dirías a alguien?; no le diría a nadie; después de un tiempo iría a la policía; Se lo diría a la persona más querida que tengo.;
875;Reaction - Blue;40; De repente recibes un beso de una persona desconocida, ¿qué haces?; permanezco inmóvil; Yo me enojo; Me escapé;
876;Reaction - Blue;40; Hiciste una gran victoria, ¿qué haces?; no le digo a nadie;Ofrezco un trago a todos.; Inmediatamente pienso en mi futuro.;
877;Reaction - Blue;40; Durante una salida en bicicleta se desata una tormenta muy fuerte, ¿qué haces?; Estoy buscando un lugar para cobijarme; Empiezo a pedalear rápido; Disfruto de la tormenta continuando la salida en bici;
878;Reaction - Blue;40; Un perro callejero viene hacia ti gruñendo, ¿qué haces?; Me escapé; trato de mantener la calma; Me quedo indiferente y sigo mi camino;
879;Reaction - Blue;40; Si tomaras el control de un avión que se estrella, ¿dónde intentarías aterrizar?; En un campo; en una pista de aterrizaje; en el agua;
880;Reaction - Blue;40; Si ocurre un terremoto, ¿qué haces?; salgo corriendo a la calle; me quedo donde estoy; Intento ayudar a los que están cerca de mí.;
881;Reaction - Blue;40; Estás en el primer piso de un edificio cuando se produce un incendio, ¿qué haces?; me tiro desde el balcon de la casa; tomo el ascensor; corro escaleras arriba;
882;Reaction - Blue;40; Si te pierdes por la noche en un lugar aislado, ¿qué haces?; me quedo donde estoy; estoy buscando ayuda; No sé;
883;Reaction - Blue;40;¿Has soñado con nadar en el océano entre los peces, cómo te sientes al despertar?; me siento sereno; empiezo el día positivamente; Siento miedo, le tengo miedo al agua.;
884;Reaction - Red;43; Estás en una isla desierta y necesitas construirte un refugio, ¿dónde lo consigues?; en la playa; arriba en la colina; en cualquier lugar está bien;
885;Reaction - Red;43; Estás en una fiesta con tu hijo pero nadie juega con él, ¿qué haces?; Lo animo a que conozca a los otros niños.; me lo llevo; observo como se comporta;
886;Reaction - Red;43; Hiciste un examen y estabas convencido de que estabas preparado pero reprobaste, ¿cómo te comportas?; me enojo con el profesor; Creo que lo haré mejor la próxima vez.; cambio de curso de estudio;
887;Reaction - Red;43; Si te encontraras con nativos en una isla desierta, ¿cómo te comportarías?; les pediria ayuda; me escaparía; trataría de hablar con ellos;
888;Reaction - Red;43; Un insecto nunca visto se arrastra por tu ventana, ¿cómo te comportas?;mato al insecto; no pretendo nada; Llamo a alguien para mostrarles el insecto;
889;Reaction - Red;43; Llegaste a la caja pero olvidaste tu billetera, ¿qué haces?; me disculpo y me voy a casa; Pregunto si me pueden dar la mercancía de todos modos; Le pido a alguien si me puede prestar algo de dinero;
890;Reaction - Red;43; Estás en un bosque, ¿cómo son los árboles?; alto y grueso; bajo y escaso; en muy mal estado;
891;Reaction - Red;43; Estás en un bosque, ¿a qué hora del día?; noche; día; puesta de sol;
892;Reaction - Red;43; Estás en un bosque y tienes un arroyo frente a ti, ¿cómo es?; profundo; bajo; muy ancho;
893;Reaction - Red;43; Estás en un bosque y te encuentras con un río frente a ti, ¿qué haces?; lo cruzo; me quedo donde estoy; Espero que alguien venga a ayudarme.;
894;Reaction - Red;43; Estás en un bosque, es de noche y encuentras una cueva oscura, ¿qué haces?; entro de inmediato; tengo miedo pero entro; No entro, tengo miedo.;
895;Reaction - Red;43; Estás caminando por un bosque, ¿cuál es el color que domina el paisaje?;verde brillante; verde oscuro; rojo;
896;Reaction - Red;43; Estás en un bosque, ¿cómo está el clima?; hay un hermoso dia; esta muy nublado; es un día sombrío;
897;Reaction - Red;43; En un bosque encuentras una llave, ¿cómo es?; oxidado; nuevo; ligeramente desgastado;
898;Reaction - Red;43; Estás ocupado pero el teléfono sigue sonando, ¿qué haces?; siempre respondo; respondo de vez en cuando; no contesto el teléfono;
899;Reaction - Red;43; Olvidaste el grifo abierto pero estás en el trabajo, ¿qué haces?; vengo a casa; llamo a un vecino; Lo cerraré cuando llegue a casa.;
900;Reaction - Red;43; Tu bebé no deja de llorar, ¿qué haces?; trato de calmarlo; llamo a mis padres; yo voy al hospital;
901;Reaction - Red;43; Llaman a la puerta por la noche, ¿qué haces?; Finjo que no estoy allí; les pregunto quienes son; Me apresuro a abrirlos con mucho miedo;
902;Reaction - Red;43; Eres testigo del robo de tu auto, ¿qué haces?; Llamaré a la policía; Me desespero; Trato de detener a los ladrones;
903;Reaction - Red;43;Eres testigo de una pelea entre dos de tus amigos, ¿qué haces?; trato de dividirlos; me enojo con los dos; Tomo la defensa de uno solo;
904;Reaction - Red;43; Entras en una tienda y ves a alguien gastando mucho dinero, ¿qué piensas?; el es rico; ¿de dónde viene el dinero?; Suertudo;
905;Reaction - Pink;42; Tu mejor amigo, después de muchos sacrificios consigue un ascenso en tu empresa, ¿qué haces?; lo felicito; me quedo indiferente; ya no soy su amigo;
906;Reaction - Pink;42; Se le presenta una oferta de ganancias importante pero poco clara, ¿qué hace?; rechazo la oferta; acepto inmediatamente; Me tomo el tiempo para decidir qué hacer.;
907;Reaction - Pink;42; Mientras caminas de noche te detiene una chica encantadora, ¿qué haces?; me detengo a conocerla; Me escapé; Le pregunto si necesita ayuda.;
908;Reaction - Pink;42; Entras en el ascensor y te encuentras a solas con una joven que tiene un grave defecto físico, ¿qué haces?; no pretendo nada; Miro a mi alrededor; Secretamente miro su problema; la miro fijamente
909;Reaction - Pink;42;Caminando por una playa encuentras una pulsera de oro, ¿qué haces?; busco socorrista; Detengo a las personas cercanas a mí.; lo vendo;
910;Reaction - Pink;42; Durante un viaje en una lancha a motor, el motor de la lancha se descompone. ¿A qué te dedicas?; trato de arreglar el motor; entro en pánico; Intento contactar con alguien que me pueda ayudar.;
911;Reaction - Pink;42; Estás en una entrevista con otras 4 personas, todas están contratadas menos tú. ¿A qué te dedicas?; Me escapé; me enojo mucho; exijo explicaciones;
912;Reaction - Pink;42; Te enteras que tus compañeros de trabajo son amantes, ¿qué haces?; me quedo indiferente; le digo al jefe; se lo digo a mis otros compañeros;
913;Reaction - Pink;42; Estás en un lugar desconocido, ¿qué haces?; Me escapé; yo uso el navegador; Memorizo el nombre de una calle a mi alrededor;
914;Reaction - Pink;42; Te encuentras en una nueva ciudad sin celular y solo un mapa en tus manos, ¿qué haces?; no se como usarlo; me oriento facilmente; Estudio el mapa para saber a dónde ir.;
915;Reaction - Pink;42;Tienes que armar los muebles que te dieron, ¿qué haces?; pido ayuda; los armo facilmente; no es fácil pero puedo hacerlo;
916;Reaction - Pink;42; Tienes que organizar el evento de tus sueños, ¿dónde lo organizas?; en una playa maravillosa; en una lujosa villa; en un hermoso jardín;
917;Reaction - Pink;42; Cuando hablas por teléfono con alguien, ¿qué haces?; pienso en otra cosa; yo fumo; Solo me concentro en la llamada;
918;Reaction - Pink;42; Estás frente a un castillo, ¿de qué material es la puerta de entrada?; madera; vidrio; planchar; el plastico
919;Reaction - Pink;42; Estás frente a un castillo, ¿cuál es la característica de la puerta principal?; es simple; esta cubierto de plantas; es enorme;
920;Reaction - Pink;42; Acabas de entrar en un castillo, ¿qué es lo primero que ves?; una gran chimenea; una habitación grande con una hermosa decoración; una biblioteca con miles de libros; un pasillo muy estrecho
921;Reaction - Pink;42; Estás dentro de un castillo y te encuentras con una escalera, ¿cómo es?; espiral;es enorme con escalones muy anchos; es muy alto;
922;Reaction - Pink;42; Estás dentro de un castillo y entras en una habitación del piso superior, ¿qué ves desde la ventana?; un gran césped verde; un bosque lleno de nieve; un mar tormentoso; una ciudad
923;Reaction - Pink;42; Acabas de entrar en un castillo y encuentras una puerta trasera que conduce a un patio, ¿cómo es?; es hermoso y ordenado; es desordenado pero sería hermoso si se mantuviera bien; está mal mantenido y da miedo;
924;Reaction - Pink;42; Entraste en un castillo, ¿quién es el propietario?; una persona agradable; una persona aterradora; el castillo está deshabitado;
925;Reaction - Green;41; Has entrado en un castillo y tienes mucha hambre, ¿qué encuentras para comer?; nada; cada manjar; solo carne de caza;
926;Reaction - Green;41; Estás frente a un castillo, ¿de qué tamaño es?; es pequeño y bien mantenido; es genial pero se esta cayendo a pedazos; es grande y cuidada en cada detalle;
927;Reaction - Green;41;¿Qué camino tomaste para llegar frente a un hermoso castillo?; un camino estrecho; Pasé por hermosos campos verdes; un camino de tierra pero grande;
928;Reaction - Green;41; Has entrado en un castillo y ves una mesa grande, ¿qué forma tiene?; hexagonal; circular; rectangular;
929;Reaction - Green;41; Has entrado en un castillo, está oscuro pero encuentras 20 velas, ¿cuántas enciendes?;20;1; entre 2 y 10; entre 11 y 19
930;Reaction - Green;41; Has entrado en un castillo y dentro solo vive un animal, ¿cuál es?; un perro; un tigre; un loro; un gato
931;Reaction - Green;41; En tu funeral...; nadie aparece; hay lleno de gente; solo están las personas más cercanas a mí;
932;Reaction - Green;41; En tu boda...; somos muy pocos; es una gran fiesta; solo somos yo y el que amo;
933;Reaction - Green;41; ¿Cuál de estas situaciones preferirías…; un mundo donde yo gobierno sobre todos; un mundo donde no hay diferencias; un mundo donde todos tienen grandes oportunidades;
934;Reaction - Green;41;Si tuvieras una máquina del tiempo...; Borraría la muerte de un ser querido; corregiría mis errores; Cambiaría algunos hechos históricos;
935;Reaction - Green;41; Te encuentras con un adivino que anuncia la boda de tu hijo, ¿qué le preguntas?; nada; ¿cuándo se casará?; si el matrimonio va bien;
936;Reaction - Green;41; Si pudieras elegir una nueva carrera, ¿cuál te gustaría ser?; un médico de renombre internacional; una estrella de cine; un gran abogado; amo mi carrera
937;Reaction - Green;41; Si pudieras elegir qué agregar a tu vida, ¿qué sería?; más tiempo; mas dinero; más amor;
938;Reaction - Green;41; El barco en el que viajas volcó, ¿qué haces?; Sacrifico a un pasajero para salvar a un familiar; Me salvo sacrificando a otro pasajero; trato de escapar;
939;Reaction - Green;41; Tienes la capacidad de cambiar la hora, ¿qué preferirías hacer?; cambiar el pasado; revisa el presente; conocer y cambiar el futuro;
940;Reaction - Green;41;¿Qué dices antes de tomar una foto?; ¡Queso!; estoy contando; nada;
941;Reaction - Green;41; Un niño pequeño se cae mientras corre, ¿cómo reaccionas?; yo me asusto; Me río; creo que si hubiera tenido cuidado no le hubiera pasado nada;
942;Reaction - Green;41; Estás caminando en una gran ciudad y te encuentras con muchas personas, ¿cuántas te sonríen?; muchos; muy pocos; solamente una persona;
943;Reaction - Green;41; Tienes que hacer reír a un extraño, ¿qué le dices?; una broma; una anécdota de mi vida; mi defecto;
944;Reaction - Green;41; En una fiesta te quieren sacar fotos constantemente, ¿tú que opinas?; odio las fotos; estoy feliz; la gente es muy grosera;
945;Money - Green;29; Te dan un regalo de poco valor, que opinas?; Lo aprecio; eso suena a burla; la gente es tacaña;
946;Money - Green;29; Te invitan a almorzar y te hacen pagar la cuenta, que opinas?; me quedo sin palabras; nunca volveré a salir juntos; quien me invitó no es muy educado;
947;Money - Green;29;Un amigo lleva puesto el reloj de tus sueños, ¿qué te parece?; me vendría mejor; me alegro por el/ella; como lo compro, es un misterio;
948;Money - Green;29; Quien te invitó cancela la cita unos minutos antes de tu reunión, ¿qué opinas?; inventó una excusa; él realmente tenía un problema; el es una persona grosera;
949;Money - Green;29; ¿En qué te hace pensar la forma de un prisma?; éxito; una forma geometrica; misterio;
950;Money - Green;29; Tu mejor amigo te señala un grave error que cometiste, que opinas:; gracias por la ayuda preciosa; Métete en tus asuntos; siempre señala solo las cosas negativas;
951;Money - Green;29; ¿Te gustaría ganar la lotería?; seguramente; no; tal vez, tendría miedo de ganar mucho dinero;
952;Money - Green;29; Si cobraras una gran cantidad en la lotería, ¿qué harías?; cambiaria mi vida; compraría todo lo que quisiera; no cambiaría nada para mí;
953;Money - Green;29; Asocias el dinero con:; felicidad; energía; tranquilidad; codicia
954;Money - Green;29; ¿A qué compra no podrías renunciar?;máquina; libros; alimento;
955;Money - Green;29; Encuentras un papel en la calle, ¿qué está escrito en él?; una carta de amor; un código bancario secreto; una solicitud de ayuda;
956;Money - Green;29; Te obligan a ver un programa, ¿de qué se trata?; un noticiero; una pelicula romantica; un programa cientifico; un documental
957;Money - Green;29; La tienda cerca de tu casa tiene precios caros, ¿la prefieres a una lejana con precios más baratos?; sí; no; solo si los dueños son muy amables;
958;Money - Green;29; Quieres hacerle un regalo a la persona que amas pero no tienes dinero, ¿qué haces?; pediré dinero prestado; Me rindo; nunca me ha pasado;
959;Money - Green;29; Un extraño te puso en su testamento, ¿qué te parece?; Tuve mucha suerte; sin duda es un error; ¡Me lo merezco!;
960;Money - Green;29; Compraste, sin saberlo, una casa arriba de un posible campo petrolero, ¿qué haces?; Intento revender la casa ganando dinero.; Compro maquinaria para extraer aceite; No me importa y sigo viviendo sin pensarlo;
961;Money - Green;29;Si piensas en tus metas económicas para los próximos 3 meses, ¿qué te viene a la mente?; hacérse Rico; ahorrar dinero; mantener mi nivel de vida actual;
962;Money - Green;29; ¿Siempre sales con mucho dinero en el bolsillo?; sí; no; poco frecuentemente; muy a menudo
963;Money - Green;29; ¿Te gustaría estimar el valor de algunos objetos?; sí; no;tal vez, nunca lo he intentado;
964;Money - Green;29; ¿Conservas los detalles de los pagos que has realizado?; sí; no; poco frecuentemente; casi siempre
965;Money - Green;29; ¿Le gustaría supervisar todos los aspectos de una empresa que cotiza en bolsa?; sí; no, no estoy interesado; tal vez eso sería genial; no, es muy complicado
966;Money - Pink;30; ¿Por qué a algunas personas les gusta gastar dinero?; sentirse único; sentir emociones fuertes; ser admirado por los demás;
967;Money - Pink;30;“Es mejor el uso de las riquezas que la posesión de ellas.”;estoy de acuerdo;no estoy de acuerdo;estoy de acuerdo sólo en parte;
968;Money - Pink;30;“El oro es como las mujeres, que todos dicen mal de ellas y todos las desean.”;estoy de acuerdo;no estoy de acuerdo;estoy de acuerdo sólo en parte;
969;Money - Pink;30;“La verdadera riqueza se halla en el corazón, no en la cartera.”;estoy de acuerdo;no estoy de acuerdo;estoy de acuerdo sólo en parte;
970;Money - Pink;30;“La importancia de las cantidades de dinero varia notablemente según hayan de ser pagadas o cobradas.”;estoy de acuerdo;no estoy de acuerdo;estoy de acuerdo sólo en parte;
971;Money - Pink;30;“La riqueza no se mide por las cosas que se poseen sino por aquellas de las que sabemos prescindir.”;estoy de acuerdo;no estoy de acuerdo;estoy de acuerdo sólo en parte;
972;Money - Pink;30;“Arreglar los problemas no es difícil: lo único necesario es dinero.”;estoy de acuerdo;no estoy de acuerdo;estoy de acuerdo sólo en parte;
973;Money - Pink;30;“La riqueza consiste mucho más en el disfrute que en la posesión.”;estoy de acuerdo;no estoy de acuerdo;estoy de acuerdo sólo en parte;
974;Money - Pink;30;“El dinero no comprará la felicidad a quien no sabe que desea.”;estoy de acuerdo;no estoy de acuerdo;estoy de acuerdo sólo en parte;
975;Money - Pink;30;“Mejor acostarse con hambre que levantarse con deudas.”;estoy de acuerdo;no estoy de acuerdo;estoy de acuerdo sólo en parte;
976;Money - Pink;30;“Nada existe más dulce que la miel, excepto el dinero.”;estoy de acuerdo;no estoy de acuerdo;estoy de acuerdo sólo en parte;
977;Money - Pink;30;"“Presta dinero a tu enemigo y lo ganarás a él; préstalo a tu amigo y lo perderás.”";estoy de acuerdo;no estoy de acuerdo;estoy de acuerdo sólo en parte;
978;Money - Pink;30;“El dinero no puede comprar la vida.”;estoy de acuerdo;no estoy de acuerdo;estoy de acuerdo sólo en parte;
979;Money - Pink;30;“Gasta siempre una moneda menos de lo que ganes.”;estoy de acuerdo;no estoy de acuerdo;estoy de acuerdo sólo en parte;
980;Money - Pink;30;“El dinero siempre tiene dos inconvenientes: demasiado o demasiado poco.”;estoy de acuerdo;no estoy de acuerdo;estoy de acuerdo sólo en parte;
981;Money - Pink;30;“El dinero es el sustituto técnico de Dios.”;estoy de acuerdo;no estoy de acuerdo;estoy de acuerdo sólo en parte;
982;Money - Pink;30;“La única forma de no pensar en el dinero es tener una gran cantidad del mismo.”;estoy de acuerdo;no estoy de acuerdo;estoy de acuerdo sólo en parte;
983;Money - Pink;30;"“Sin creer puede vivirse; sin crédito es imposible.”";estoy de acuerdo;no estoy de acuerdo;estoy de acuerdo sólo en parte;
984;Money - Pink;30;“Un rico es diferente al que no lo es: tiene más dinero.”;estoy de acuerdo;no estoy de acuerdo;estoy de acuerdo sólo en parte;
985;Money - Pink;30;"""El verdadero medio de ganar mucho consiste en no querer nunca ganar demasiado.”";estoy de acuerdo;no estoy de acuerdo;estoy de acuerdo sólo en parte;
986;Money - Pink;30;“Soy un revolucionario, el dinero no significa nada para mí.”;estoy de acuerdo;no estoy de acuerdo;estoy de acuerdo sólo en parte;
987;Money - Pink;30; Un tío te deja una fortuna, ¿qué te parece?; ¡Me lo merezco!; no lo merezco; Creo que es muy importante ser caritativo.;
988;Communication - Pink;5; ¿Está más impresionado por la forma general que por los diversos detalles que la componen?; no; solo parcialmente; suficiente; seguramente
989;Communication - Pink;5; Cuando cuentas algo sobre tu pasado, ¿te gusta centrarte en los detalles?; no; algunas veces; casi siempre; siempre
990;Communication - Pink;5; Cuando miras una pintura, ¿te fascina la vista general?; no; algunas veces; casi siempre; siempre
991;Communication - Pink;5; Cuando miras una figura, ¿primero analizas los detalles?; no; algunas veces; casi siempre; siempre
992;Communication - Pink;5;¿Entiendes fácilmente un tema si primero te dan una descripción general?; no; algunas veces; casi siempre; sí
993;Communication - Pink;5; ¿Te resulta más fácil entender algo si te lo explican punto por punto?; no; algunas veces; casi siempre; sí
994;Communication - Pink;5; ¿Se siente cómodo cuando tiene una visión global del tema?; no; algunas veces; casi siempre; sí
995;Communication - Pink;5; ¿Te gustan los juegos de palabras?; no; suficiente; sí;
996;Communication - Pink;5; ¿Memorizas números con más facilidad cuando están escritos sin una lógica precisa, que dentro de unos gráficos?; no; suficiente; sí;
997;Communication - Pink;5; ¿Te gustan los libros con muchas imágenes?; no; suficiente; sí;
998;Communication - Pink;5; ¿Entiendes mejor las cosas cuando puedes usar diagramas y/o gráficos?; no; algunas veces; casi siempre; sí
999;Communication - Pink;5; ¿Te resulta fácil expresarte con un texto escrito?; no; suficiente; sí;
1000;Communication - Pink;5; ¿Prefieres estudiar sobre representaciones visuales en lugar de textos escritos?; no; algunas veces; sí; casi siempre
1001;Communication - Pink;5; ¿Recuerdas cómo se ve un lugar más fácilmente que su nombre?; no; poco frecuentemente; sí; casi siempre
1002;Communication - Pink;5; ¿Alguna vez te has quedado asombrado frente a un cuadro?; sí; no; talvez una vez;
1003;Communication - Pink;5; ¿Tienes un amplio repertorio léxico?; sí; no; promedio;
1004;Communication - Pink;5; Tu forma de pensar se parece a la de...; un ingeniero; un filosofo; un artista; una estrella
1005;Communication - Pink;5;¿Cómo organizas tus días?; escribir citas en una hoja; teniendo en cuenta las cosas que hacer; nunca organizo nada;
1006;Communication - Purple;6; ¿Entiende fácilmente los nuevos conceptos que se le proponen?; sí; no; suficiente; casi siempre
1007;Communication - Purple;6; ¿Tienes que repetir las cosas que dices porque la gente no las entiende?; sí; no; algunas veces; casi siempre
