188;Love - Blue;23;“El amor es una ocupación como otra cualquiera.”;estoy de acuerdo;no estoy de acuerdo;estoy de acuerdo sólo en parte;
189;Love - Blue;23;“El primer beso no se da con la boca, sino con la mirada.”;estoy de acuerdo;no estoy de acuerdo;estoy de acuerdo sólo en parte;
190;Love - Blue;23;“Es tan corto el amor y tan largo el olvido.”;estoy de acuerdo;no estoy de acuerdo;estoy de acuerdo sólo en parte;
191;Love - Blue;23;"“Los hombres engañan más que las mujeres; las mujeres, mejor.”";estoy de acuerdo;no estoy de acuerdo;estoy de acuerdo sólo en parte;
192;Help;13; Si escucha programas que hablan de medicamentos o drogas, ¿siente los síntomas que se describen?; sí; no; poco frecuentemente; muy a menudo
193;Help;13; ¿Tienes miedo de conducir por carreteras que nunca has hecho antes?; sí; no; algunas veces;
194;Help;13; ¿Duermes bien por la noche?; sí; no; poco frecuentemente; casi siempre
195;Help;13; ¿Le tienes miedo a la oscuridad?; sí; no; depende de donde estoy;
196;Help;13; ¿Afrontas lo inesperado con serenidad?; sí; no; poco frecuentemente; casi siempre
197;Help;13;¿Puede mantener su concentración durante un período prolongado de tiempo?; sí; no; poco frecuentemente; casi siempre
198;Help;13; ¿Siempre reservas antes de salir de vacaciones?; sí; no; casi siempre;
199;Help;13; ¿Te relajas en vacaciones?; sí; no; casi siempre; poco frecuentemente
200;Help;13; Antes de dormir, ¿preparas la ropa que usarás al día siguiente?; sí; no; muy a menudo; poco frecuentemente
201;Help;13; Cuando una persona querida se demora, ¿piensas que pasó algo malo?; sí; no; muy a menudo; poco frecuentemente
202;Help;13; ¿Alguna vez has sentido que te cuesta respirar?; sí; no; muy a menudo; poco frecuentemente
203;Help;13; ¿Tienes pesadillas?; siempre; con frecuencia; algunas veces; nunca
204;Help;13; ¿Siente que es incapaz de realizar ciertas tareas importantes que se le asignan?; sí; no; algunas veces; muy a menudo
205;Help;13; ¿Tienes algún tic?; sí; no; a veces siento que tengo;
206;Help;13; ¿Digieres bien?; sí; no; poco frecuentemente; casi siempre
207;Help;13; ¿Cuál de estas tres obras de arte te causa más ansiedad?; El grito; Guernica; El joven Baco enfermo;
208;Help;13; ¿Cómo te hace sentir observar un agujero negro?; ansiedad; curiosidad; sentimiento de ser insignificante;
209;Help;13; Estás en un avión y hay fuertes turbulencias, ¿qué haces?; entro en pánico; Descanso relajado como si nada hubiera pasado;Trato de asegurarme mirando a la tripulación.;
210;Help;13; ¿Te gusta tener días ocupados?; sí; no; algunas veces;
211;Help;13; ¿El timbre del teléfono te causa ansiedad?; sí; no; algunas veces; muy a menudo
212;Help;13; Un ser querido te dice que necesitas reunirte enseguida para hablar, ¿qué opinas?; una cosa mala; una buena noticia; no tengo ninguna idea en particular;
213;Help;13; Por la noche:; yo duermo; trabajo; pienso; yo juego
214;Great Wall;12; ¿Cuál es tu fuerza entre estos?; disciplina; fiabilidad; creatividad; compromiso
215;Great Wall;12; ¿Cuál es tu mayor miedo entre estos?; no tener éxito en los negocios; no creas en mi mismo; estar solo;
216;Great Wall;12; ¿Qué es lo que más te enoja de estas cosas?; niños gritando; gente grosera; padres cariñosos; mentiras
217;Great Wall;12; ¿Qué te hace reír más entre estas cosas?; un comediante en la televisión; una broma de un amigo; cuando veo que se burlan de una persona; cuando leo un libro sarcástico
218;Great Wall;12;Si pudieras elegir hacer una de estas cosas por un día, ¿qué harías?; me iria de viaje; haría deporte; jugaría; yo trabajaría
219;Great Wall;12; ¿Preferirías?; paseo a caballo; ir a la pista con un coche; Dar un paseo;
220;Great Wall;12; ¿Cuál de estas actividades en casa elegirías?; limpia el baño; corta la hierba; lavar los platos; Aspirar
221;Great Wall;12; ¿Cuál de estos alimentos prefieres?; carne; verduras; Leche; pasta
222;Great Wall;12; Si tuvieras que elegir un apodo, ¿cuál elegirías?; Bebé; Jefe; Rayo;
223;Great Wall;12; ¿Te gustan las sorpresas?; no; sí; depende del tipo de sorpresa;
224;Great Wall;12; ¿Cuál de estas es tu debilidad?; paciencia; compromiso; determinación;
225;Great Wall;12; ¿Cuál de estas cosas preferirías hacer por la noche?; ver una película; estar en compañía de amigos; quedarse en casa con la familia; Lee un libro
226;Great Wall;12; ¿Cuánto tiempo te gustaría vivir en una isla desierta?; toda la vida;solo un día; unos meses; ni siquiera un día
227;Great Wall;12; Si tuvieras una cantidad infinita de dinero, ¿cuál de estas cosas harías?; yo no los usaria; Los daría todos a la caridad.; Me compraría todas las cosas lujosas que quiero;
228;Great Wall;12; ¿Cuál de estos medios de transporte elegirías?; autobús; avión; coche; tren
229;Great Wall;12; ¿Cuál de estos animales del zoológico prefieres?; león; mono; jirafa; llevar
230;Great Wall;12; ¿Cuál de estas materias escolares prefieres?; matemáticas; historia; Arte;
231;Great Wall;12; ¿Cuál de estas oraciones elegirías?; Paren la guerra; Detener la pobreza; Detén el trabajo;
232;Great Wall;12; ¿Cuántos idiomas hablas?;1;2;3/4; más de 4
233;Great Wall;12; ¿Quién de estas personas conoce tu mejor parte?; mis padres; un amigo; nadie; mi compañero
234;Great Wall;12; ¿Cuál de estos artículos llevarías siempre contigo?; el anillo de bodas; una foto mía; un libro; una foto de mi familia
235;Great Wall;12;¿Cuál de estas edades es la mejor?;20;30;40;50
236;Great Wall;12; ¿Cuál de estas es la mejor manera de empezar el día?; juega con mi perro; beber un cafe; hacer deporte; tener un buen desayuno
237;Rainbow - Dark;38; ¿Qué color asocias con la palabra generosidad?; blanco; verde; amarillo;
238;Rainbow - Dark;38; ¿Qué color asocias con la palabra belleza?; violeta; azul; gris; amarillo
239;Rainbow - Dark;38; ¿Qué color asocias con la palabra tristeza?; negro; marrón; azul;
240;Rainbow - Dark;38; ¿Qué color asocias con la palabra ocasión?; rojo; fucsia; verde;
241;Rainbow - Dark;38; ¿Qué color asocias con la palabra decisión?; negro; blanco; gris; rojo
242;Rainbow - Dark;38; ¿Qué color asocias con la palabra sinceridad?; verde; amarillo; azul; blanco
243;Rainbow - Dark;38; ¿Qué color asocias con la palabra crueldad?; negro; rojo; azul; violeta
244;Rainbow - Dark;38; ¿Qué color asocias con la palabra ambición?; amarillo; verde; gris;
245;Rainbow - Dark;38; ¿Qué color asocias con la palabra paz?; azul claro; azul; marrón;
246;Rainbow - Dark;38; ¿Qué color asocias con la palabra felicidad?; azul; azul claro; verde; amarillo
247;Rainbow - Dark;38; Si usaras una capa, ¿de qué color la querrías?; rojo; negro; verde;
248;Rainbow - Dark;38; ¿Qué tipo de color prefieres?; caliente; frío;Amo todos los colores;
249;Rainbow - Dark;38; Si pudieras elegir el color de tus ojos, ¿cuál sería tu favorito?; verde; azul claro; mi color es el mas hermoso; negro
250;ColoriRainbow - Bright;39; Tienes que volver a pintar tu casa, ¿qué colores eliges?; blanco; colores oscuros; colores brillantes; colores claros
251;ColoriRainbow - Bright;39; ¿Dónde destaca más tu color favorito?; en un vestido; en una casa; en un auto;
252;ColoriRainbow - Bright;39; ¿Qué sensaciones te despierta el color negro?; inmovilidad; miedo; serenidad;
253;ColoriRainbow - Bright;39; ¿Qué sensaciones te despierta el color rojo?; energía; Voltaje; agresión;
254;ColoriRainbow - Bright;39; ¿Qué sensaciones te despierta el color amarillo?; ligereza; ambición; felicidad;
255;ColoriRainbow - Bright;39; ¿Qué sensaciones te despierta el color verde?; equilibrio; positividad; negatividad;
256;ColoriRainbow - Bright;39; ¿Qué sensaciones te despierta el color naranja?; protagonismo; rechazo; serenidad;
257;ColoriRainbow - Bright;39; ¿Qué sensaciones te despierta el color morado?; decepcionado; ansiedad; equilibrio;
258;ColoriRainbow - Bright;39;¿Qué sensaciones te despierta el color marrón?; alegría; inconformismo; negatividad;
259;ColoriRainbow - Bright;39; ¿Qué sensaciones te despierta el color blanco?; pureza; miedo; tranquilo;
260;ColoriRainbow - Bright;39; ¿Cuál de estos tres colores elegirías?; gris negro azul; rojo amarillo naranja; morado rosa blanco;
261;ColoriRainbow - Bright;39; ¿Cuál de estos pares de colores elegirías?; azul verde; marrón amarillo; amarillo morado;
262;Fantasy - Gold;10; ¿Pasas mucho tiempo pensando en lo que otras personas piensan de ti?; sí; no; rara vez pienso en eso;
263;Fantasy - Gold;10; ¿Respetas a las personas inseguras?; sí; no; muy poco;
264;Fantasy - Gold;10; ¿Valoras a alguien más que a ti mismo?; sí; no; algunas veces;
265;Fantasy - Gold;10; ¿Eres capaz de insistir en conseguir algo que quieres?; sí; no; poco frecuentemente;
266;Fantasy - Gold;10; ¿Ocasionalmente te dejas atrapar por picos de entusiasmo?; sí; no; poco frecuentemente; muy a menudo
267;Fantasy - Gold;10; ¿De vez en cuando te dejas atrapar por picos de tristeza?; sí; no; poco frecuentemente; muy a menudo
268;Fantasy - Gold;10; ¿Te encanta coleccionar cosas?; sí; no; algunas veces;
269;Fantasy - Gold;10; ¿Crees que tienes una imaginación salvaje?; sí; no; tengo poca imaginacion;
270;Fantasy - Gold;10; ¿Crees que tienes mucho gusto?; sí; no; muy poco;
271;Fantasy - Gold;10;¿Está interesado en las fuentes de noticias que lee?; sí; no; muy poco; muchisimo
272;Fantasy - Gold;10; ¿Consideras que el respeto por ti mismo es más importante que el respeto por los demás?; sí; no; algunas veces; casi siempre
273;Fantasy - Gold;10; ¿Crees que las personas que buscan la perfección son sabias?; sí; no; poco;
274;Fantasy - Gold;10; ¿Te gusta manipular a los demás?; sí; no; algunas veces;
275;Fantasy - Gold;10; ¿Te gusta pensar en cosas e ideas absurdas incluso sin un propósito específico?; sí; no; poco frecuentemente; muy a menudo
276;Fantasy - Purple;11; ¿Puedes encontrar la solución a tus problemas por ti mismo?; sí; no; poco frecuentemente; casi siempre
277;Fantasy - Purple;11; ¿Analizas tus fracasos?; sí; no; con frecuencia; poco frecuentemente
278;Fantasy - Purple;11; ¿Tiendes a olvidar los nombres de las personas?; sí; no; algunas veces; muy a menudo
279;Fantasy - Purple;11; ¿Te gustaría formar parte de un gran equipo?; sí; no; algunas veces;
280;Fantasy - Purple;11; ¿Te sientes una persona confiable?; sí; no; poco frecuentemente; casi siempre
281;Fantasy - Purple;11; ¿Te atrae el misterio de la vida?; sí; no; suficiente;
282;Fantasy - Purple;11; ¿Empatizas con los personajes mientras lees un libro?; Sí; no; algunas veces; casi siempre
283;Fantasy - Purple;11; ¿Prefieres leer un libro o ver una película?; libro; película; ninguno de los dos;
284;Fantasy - Purple;11; ¿Cuál de estas disciplinas prefieres?; historia; Ciencias; física; filosofía
285;Fantasy - Purple;11; Si tuvieras que elegir un nombre para tu hijo, ¿cuál elegirías?; el nombre de una persona famosa;el nombre de un ser querido; el nombre de un personaje de dibujos animados;
286;Fantasy - Purple;11; ¿Tiendes a crear situaciones imaginarias que no existen?; no; algunas veces; con frecuencia;
287;Fantasy - Purple;11; Necesitas inspiración, ¿qué haces?; trato de quedarme solo; voy a las montañas; me siento mirando el mar;
288;Fantasy - Purple;11; Prefieres revistas de:; muebles; jardinería; Ciencias; chisme
289;Fantasy - Purple;11; ¿Crees en la importancia del arte?; sí; no; suficiente;
290;Body - Pink;3; ¿Prefieres caminar a tomar el auto?; sí; no; me encanta tomar el tren;
291;Body - Pink;3; ¿Se auto-receta medicamentos?; sí; no; Me gustaría;
292;Body - Pink;3; ¿Te sientes lleno de energía por la mañana?; sí; no; poco frecuentemente; casi siempre
293;Body - Pink;3; ¿Practicas algún deporte con regularidad?; sí; no; Me gustaría;
294;Body - Pink;3; ¿Haces actividad competitiva?; sí; no; Me gustaría;
295;Body - Pink;3; ¿Estás orgulloso de tu físico?; sí; no; poco frecuentemente; casi siempre
296;Body - Pink;3; ¿Se siente con sobrepeso?; sí; no; poco frecuentemente; casi siempre
297;Body - Pink;3; ¿Te sientes demasiado flaco?; sí; no; poco frecuentemente; casi siempre
298;Body - Pink;3; ¿Estás sujeto a fuertes cambios de peso?; sí; no; algunas veces;
299;Body - Pink;3; ¿No puedo esperar para ir a la cama por la noche?; sí; no; poco frecuentemente; muy a menudo
300;Body - Pink;3; ¿Ves la televisión hasta que cenas con tu familia?; sí; no; poco frecuentemente; casi siempre
301;Body - Pink;3;¿Te gusta quedarte despierto por la noche?; sí; no; suficiente; poco
302;Body - Pink;3; ¿Pasas muchas horas en tu celular?; sí; no; poco frecuentemente; casi siempre
303;Body - Pink;3; ¿Sueles comer fuera por trabajo?; sí; no; poco frecuentemente; casi siempre
304;Body - Red;4; ¿Se puede seguir una dieta saludable?; sí; no; poco frecuentemente; casi siempre
305;Body - Red;4; ¿Te preocupas a menudo por tu salud?; sí; no; poco frecuentemente; muy a menudo
306;Body - Red;4; ¿Te resfrías a menudo?; sí; no; poco frecuentemente;
307;Body - Red;4; ¿Tiene dificultad para concentrarse?; sí; no; suficiente;
308;Body - Red;4; ¿Tienes mucha memoria?; sí; no; suficiente;
309;Body - Red;4; ¿Te molestan los ruidos?; sí; no; suficiente;
310;Body - Red;4; ¿Te despiertas a menudo durante el sueño?; sí; no; poco frecuentemente;
311;Body - Red;4; ¿Ha tenido frecuentemente cambios de peso en su vida...; me paso muchas veces; no, siempre he tenido mas o menos el mismo peso; Me pasó una vez o algunas raras veces;
312;Body - Red;4; ¿Cómo es tu postura?; recto y perfecto; siempre un poco inclinado hacia adelante; nunca me di cuenta;
313;Body - Red;4; ¿Te gustaría que un chef se encargara de tu comida?; muchisimo; no; No sé; suficiente
314;Body - Red;4; Alimentos amargos:; me gustan; Los odio; Los pruebo de vez en cuando;
315;Body - Red;4; Alimentos grasos y dulces:; los amo; Los odio; Los pruebo de vez en cuando;
316;Body - Red;4; ¿Mascas chicle a menudo?; sí; no; poco frecuentemente; muy a menudo
317;Body - Red;4; ¿Te comes las uñas?; sí; no; poco frecuentemente; muy a menudo
318;Family - Pink;8;Cuando piensas en un recuerdo de la infancia, ¿está relacionado con mamá o papá?; mamá; Papa; a ninguno; a los dos
319;Family - Pink;8; Tus primeros recuerdos de la infancia se remontan a cuando estabas entre...; 2 y 4 años; 5 y 7 años; 8 y 10 años; no tengo recuerdos de mi infancia
320;Family - Pink;8; El llanto de un bebé...; Me conmueve; me pone nervioso; me deja indiferente;
321;Family - Pink;8; ¿Tu familia te ve como el miembro más influyente?; sí; no; algunas veces; casi siempre
322;Family - Pink;8; Cuando mi padre me contaba historias, yo pensaba:; el es un mito; siempre me cuenta historias triviales; nunca me dijo nada;
323;Family - Pink;8; Me gustaría tener un hermano o hermana para:; hablar con él/ella sobre mis problemas; ayudarlo en la vida; compartir secretos;
324;Family - Pink;8; Tu mamá se pelea en la calle con un extraño, ¿qué haces?; yo tambien me enojo; trato de calmar a mi mama; trato de distraerla;
325;Family - Pink;8; Tu hijo es extremadamente tímido, ¿qué haces para ayudarlo?;lo llevo a un psicologo; Trato de hacerlo encajar entre mucha gente.; Dejaré que supere su timidez por sí mismo.;
326;Family - Pink;8; Cuando ves una pareja feliz, ¿cómo te sientes?; feliz por ellos; celoso; indiferente;
327;Family - Pink;8; ¿Crees que tu familia te ha hecho daño alguna vez en la vida?; sí; no; algunas veces; casi siempre
328;Family - Pink;8; ¿Son los padres las personas más importantes?; sí; no; ellos deberían ser;
329;Family - Pink;8; ¿Los hijos crean problemas en la pareja?; sí; no; algunas veces; muy a menudo
330;Family - Pink;8; Cuando seas adulto, ¿deberías irte de casa?; sí; no; esa seria la mejor solucion;
331;Family - Pink;8; ¿Crees que los que han conseguido grandes éxitos en la vida no han tenido demasiadas complicaciones familiares?; sí; no; muy probable;
332;Family - Pink;8; Si tienes una buena noticia, ¿a quién le dices primero?; a un familiar; a un amigo; a nadie;
333;Family - Pink;8; Tienes una oferta de trabajo excepcional pero tienes que dejar a tus seres queridos durante cinco años, ¿aceptas?; sí; no; quizás; tengo que pensarlo mucho
334;Family - Pink;8; ¿Alguna vez has utilizado la toalla o el albornoz de un familiar?; sí; no; muy a menudo; poco frecuentemente
335;Family - Pink;8; ¿Tuviste una madre amorosa cuando eras niño?; sí; no; suficiente; muchisimo
336;Family - Pink;8;¿Tu mamá te animó a ir al jardín de infantes?; sí; no; algunas veces;
337;Family - Pink;8; ¿Te vestías de niño?; sí; no; poco frecuentemente; casi siempre
338;Family - Red;9; ¿Qué pensaba tu mamá del trabajo de las mujeres?; una cosa útil para todas las mujeres; una mujer solo tiene que cuidar de la familia; ella nunca lo mencionó;
339;Family - Red;9; ¿Mamá está celosa de ti?; sí; no; casi siempre; poco frecuentemente
340;Family - Red;9; ¿Crees que eres el ídolo de tu mamá?; sí; no; No sé; muy probable
341;Family - Red;9; ¿Mamá te daba regalos a menudo?; sí; no; poco frecuentemente;
342;Family - Red;9; ¿Mamá siempre te esperaba si volvías tarde?; sí; no; algunas veces; muy a menudo
343;Family - Red;9; ¿Tu madre refleja tu ideal de mujer?; seguramente; no; suficiente;
344;Family - Red;9;"""Las madres perdonan siempre: han venido al mundo para eso.”";estoy de acuerdo;no estoy de acuerdo;estoy de acuerdo sólo en parte;
345;Family - Red;9;“Con los hijos, pocas palabras, pero bondad y firmeza a la vez.”;estoy de acuerdo;no estoy de acuerdo;estoy de acuerdo sólo en parte;
346;Family - Red;9;“No es la carne y la sangre, sino el corazón, lo que nos hace padres e hijos.”;estoy de acuerdo;no estoy de acuerdo;estoy de acuerdo sólo en parte;
347;Family - Red;9;“El ángel de la familia es la mujer.”;estoy de acuerdo;no estoy de acuerdo;estoy de acuerdo sólo en parte;
348;Family - Red;9;"“Hay un solo niño bello en el mundo, y cada madre lo tiene.""";estoy de acuerdo;no estoy de acuerdo;estoy de acuerdo sólo en parte;
349;Family - Red;9;“Enséñame el rostro de tu madre y te diré quien eres.”;estoy de acuerdo;no estoy de acuerdo;estoy de acuerdo sólo en parte;
350;Family - Red;9;“El amor es la cadena que ata a un niño a sus padres.”;estoy de acuerdo;no estoy de acuerdo;estoy de acuerdo sólo en parte;
351;Family - Red;9;“Un buen padre vale por cien maestros.”;estoy de acuerdo;no estoy de acuerdo;estoy de acuerdo sólo en parte;
352;Family - Red;9;“Los niños son el recurso más importante del mundo y la mejor esperanza para el futuro.”;estoy de acuerdo;no estoy de acuerdo;estoy de acuerdo sólo en parte;
353;Family - Red;9;“Un padre se ocupa más de diez hijos que diez hijos de un padre.”;estoy de acuerdo;no estoy de acuerdo;estoy de acuerdo sólo en parte;
354;Family - Red;9;“El trato que se le da a los niños es el que ellos luego darán a la sociedad.”;estoy de acuerdo;no estoy de acuerdo;estoy de acuerdo sólo en parte;
355;Family - Red;9;“Sin una familia, el hombre, solo en el mundo, tiembla de frío.”;estoy de acuerdo;no estoy de acuerdo;estoy de acuerdo sólo en parte;
356;Family - Red;9;“La paz y la armonía constituyen la mayor riqueza de la familia.”;estoy de acuerdo;no estoy de acuerdo;estoy de acuerdo sólo en parte;
357;Family - Blue;7;“Por muy severo que sea un padre juzgando a su hijo, nunca es tan severo como un hijo juzgando a su padre.”;estoy de acuerdo;no estoy de acuerdo;estoy de acuerdo sólo en parte;
358;Family - Blue;7;"“La primera mitad de nuestra vida nos la estropean nuestros padres; la segunda nuestros hijos.”";estoy de acuerdo;no estoy de acuerdo;estoy de acuerdo sólo en parte;
359;Family - Blue;7;“La familia es la única institución que permite que vivan en común personas que no tienen nada en común.”;estoy de acuerdo;no estoy de acuerdo;estoy de acuerdo sólo en parte;
360;Family - Blue;7;“Un buen padre vale por cien maestros.”;estoy de acuerdo;no estoy de acuerdo;estoy de acuerdo sólo en parte;
361;Family - Blue;7;"“Las familias felices se parecen todas; las familias infelices son infelices cada una a su manera.”";estoy de acuerdo;no estoy de acuerdo;estoy de acuerdo sólo en parte;
362;Family - Blue;7;"“La ingratitud más odiosa, pero también la más común y antigua, es la de los hijos hacia sus padres.""";estoy de acuerdo;no estoy de acuerdo;estoy de acuerdo sólo en parte;
363;Family - Blue;7;“La fuerza de una familia, como la fuerza de un ejército, se funda en su mutua lealtad.”;estoy de acuerdo;no estoy de acuerdo;estoy de acuerdo sólo en parte;
364;Family - Blue;7; ¿Tu papá jugaba contigo cuando eras niño?; sí; no; poco frecuentemente; muy a menudo
365;Family - Blue;7; ¿Salías a menudo a cenar solo con tu papá?; sí; no; poco frecuentemente;
366;Family - Blue;7; ¿Alguna vez has viajado solo tú y tu papá?; sí; no; poco frecuentemente; muy a menudo
367;Family - Blue;7; Cuando sacaste una mala nota en la escuela, ¿tu papá te gritó?; siempre; nunca; poco frecuentemente; muy a menudo
368;Family - Blue;7; ¿Recuerdas que tu papá te recogió?; sí; no; no recuerdo;
369;Family - Blue;7; Cuando llegó a casa del trabajo, ¿papá habló con la familia?; sí; no; poco frecuentemente;
370;Family - Blue;7; ¿Había a menudo amigos del padre en su casa?; sí; no; poco frecuentemente; muy a menudo
371;Family - Blue;7; ¿Tu papá te impuso cierto curso de estudio?; sí; no; parcialmente;
372;Family - Blue;7; ¿Papá te ha prohibido a menudo salir con amigos?; sí; no; poco frecuentemente;
374;Family - Blue;7;“Los hijos son las anclas que atan la vida a las madres.”;estoy de acuerdo;no estoy de acuerdo;estoy de acuerdo sólo en parte;
374;Family - Blue;7;" ""El corazón de una madre es un profundo abismo en cuyo fondo siempre encontrarás el perdón""."; muy cierto; No es tan; solo estoy parcialmente de acuerdo;
375;Family - Blue;7; ¿Alguna vez tu padre te dijo que lo decepcionaste?; sí; no; una vez; muy a menudo
376;Sun - Yellow;55; ¿Comes muy rápido?; sí; no; casi siempre; solo si tengo prisa
377;Sun - Yellow;55; ¿Puedes darlo todo por una situación de fundamental importancia?; sí; no; casi siempre; poco frecuentemente
378;Sun - Yellow;55; ¿Te encanta rodearte de amigos?; sí; no; suficiente; poco
379;Sun - Yellow;55; ¿Prefieres el cine al teatro?; sí; no; amo los dos; no los atiendo
380;Sun - Yellow;55; ¿Prefieres vivir en Miami o Helsinki?; miami; helsinki; me gustaria vivir en las dos ciudades;
381;Sun - Yellow;55; ¿Hablas despacio?; siempre; nunca; poco frecuentemente; casi siempre
382;Sun - Yellow;55; ¿Sueles llegar a tiempo a una cita?; siempre; nunca; poco frecuentemente; casi siempre
383;Sun - Yellow;55; ¿Prefieres comer carne o pescado?; carne; pez; me encantan las verduras; me encanta la fruta
384;Sun - Yellow;55; Cuando suena la alarma por la mañana, ¿te levantas inmediatamente?; sí; no; poco frecuentemente; casi siempre
385;Sun - Yellow;55; ¿Tiendes a perder el control cuando te enojas?; sí; no; poco frecuentemente; casi siempre
386;Sun - Yellow;55;¿Te detienes a reflexionar durante el día?; sí; no; poco frecuentemente; muy a menudo
387;Sun - Yellow;55; ¿Respetas los límites de velocidad?; sí; no; poco frecuentemente; casi siempre
388;Sun - Yellow;55; ¿Te gusta pasar tu tiempo libre con amigos?; sí; no; poco; muchisimo
389;Sun - Yellow;55; ¿Compras ropa cara?; sí; no; muy a menudo; poco frecuentemente
390;Sun - Yellow;55; ¿Te gusta vestir casual o elegante?; casual; elegante; tengo mi propio estilo;
391;Sun - Yellow;55; ¿Te sientes observado cuando entras en un club?; sí; no; poco frecuentemente; casi siempre
392;Sun - Yellow;55; Cuando estás con compañía, ¿prefieres conducir?; sí; no; poco frecuentemente; casi siempre
393;Sun - Yellow;55; ¿Después de un mal día puedes pasar página?; sí; no; difícilmente;
394;Sun - Green;53; ¿Prefieres una margarita o una rosa?; margarita; rosa; no me gustan las flores;
395;Sun - Green;53; ¿Eres una persona sincera?; sí; no; poco frecuentemente; casi siempre
396;Sun - Green;53; ¿Tienes miedo a las cosas nuevas?; sí; no; algunas veces; casi siempre
397;Sun - Green;53; ¿Prefieres tener todo rápido o poco a poco?; todo rapido; un poco a la vez; Depende de la situación;
398;Sun - Green;53; ¿Prefieres llevar unas deportivas o unos zapatos elegantes?; Zapatillas deportivas; zapatos elegantes; Depende de la situación;
399;Sun - Green;53; ¿Visitas amigos sin avisarles de tu llegada?; sí; no; poco frecuentemente; casi siempre
400;Sun - Green;53; ¿Te gusta contar chistes verdes?; sí; no; poco frecuentemente;
401;Sun - Green;53;¿Te gusta dar regalos inesperados?; sí; no; no me gusta dar regalos;
402;Sun - Green;53; Cuando estás de mal humor, ¿los demás lo notan?; sí; no; poco frecuentemente; casi siempre
403;Sun - Green;53; ¿Te llevas bien con tus vecinos?; sí; no; depende de como se comporten los vecinos;
404;Sun - Green;53; ¿Prestas de buena gana tus cosas si alguien te las pide?; sí; no; Los presto pero soy muy celoso de mis cosas;
405;Sun - Green;53; ¿Prefieres hablar o escuchar?; hablar; escuchar; me gustan las dos situaciones;
406;Sun - Green;53; ¿Necesita tranquilidad?; sí; no; algunas veces; casi siempre
407;Sun - Green;53;" ¿Usas a menudo la palabra ""gracias""?"; sí; no; poco frecuentemente; muy a menudo
408;Sun - Green;53; ¿Crees que la gente te respeta?; sí; no; Nunca pensé en ello;
409;Sun - Green;53; ¿Escuchas de buen grado a una persona que te confía su problema?; sí; no; poco frecuentemente;
410;Sun - Green;53; ¿Sueles invitar gente a tu casa?; sí; no; poco frecuentemente; muy a menudo
411;Sun - Green;53; Si una persona expresa una opinión contraria a la tuya, ¿te pones nervioso?; sí; no; depende de como lo exprese;
